file_name,caption,duration
oOiwmRV1PBk.wav,"This music clip is a loud, boomy drum beat. The tempo is slow with the powerful and rhythmic beat of the Big Chinese drum. It is loud, resonating, vibrating and powerful and sounds ceremonial, celebratory and royal and used for announcements.",10.0
5n8I-br2n1U.wav,a female voice is singing to a digital drum set along with a bass and old disco synthesizer sounds. The singer gets backed by a male singer and the crowd is singing along. There is clapping from the crowd. This song may be playing live at a concert.,10.0
aNjtfIoVzas.wav,This song contains a plucked string instrument playing a melody in the higher register along with an acoustic guitar strumming chords on the backbeat and an upright bass playing a simple melody along to the lead melody. This song may be playing in a video-presentation.,10.0
Sa3Ky5sJshU.wav,"This is an instrumental cover of a J-pop music piece. There is no singer in this piece. The melodic background consists of the keyboard and the bass playing a repeated theme. There is a synth solo with an electric guitar sound being played as the lead. In the rhythmic background, there is a fast tempo electronic drum beat. The atmosphere is danceable and energetic. This piece can be used in the soundtrack of a car racing video game. It could also be used in the soundtrack of an anime during competitive scenes.",10.0
T0oF8MyYhBM.wav,The Kurdish Folk music features an ambience choir synth accompanied by a piano melody. The vocals are passionate and almost romantic. The music might be playing in an eastern romantic TV show.,10.0
X7qFgrAl3OU.wav,"A male vocalist sings this spirited song. The tempo is fast with electronic instrumentation, synthesiser articulation and turn table. The song is spirited,youthful , enthusiastic, energetic, vigorous and vital. This song is an EDM/ Synth Pop song.",10.0
j-TVVmVmygg.wav,"The low quality recording features an arpeggiated acoustic guitar melody and some cars passing by sounds in the background. It sounds heartfelt, emotional and sad. The recording is noisy.",10.0
aCUZuMblJPg.wav,The track would fit the funk fusion music genre. The main melodic element is a synth electric guitar that plays a solo with a lot of energy and presence. In the background a drum loop that sounds very electronic is played. The music is upbeat and simple. This song would fit a car racing video game.,10.0
Wil8e6kBxe8.wav,This song contains a mandolin being strummed along to a clicking sound. This song may be playing in a video-tutorial.,10.0
6vM7Kv42Uv0.wav,"The low quality recording features a pop song that consists of stuttering vocal effects, flat male vocal speaking alongside female vocal, bleating goat sound effect, some percussive elements, boomy bass, crispy snare and shimmering hi hats. There are some scratching effects in the left channel of the stereo field. It sounds funny and like it is a parody song.",10.0
nUs5SJyQPnM.wav,"This music is an Indian classical instrumental. The tempo is fast with an animated Sitar lead, supported with rhythmic beats of lively tabla and dholak , along with a soft and subtle keyboard accompaniment. The music is upbeat, vibrant, vivacious, vigorous , engaging and captivating. This instrumental is a Hindustani classical.",10.0
wsJ5ZLKiPzs.wav,Someone is playing a cowbell along with other percussion such as congas along to a pumping bassline. A piano and a brass section are playing a countermelody to the female and male voices singing. In the background you can hear people cheering and whistling. This is an amateur recording and of poor audio-quality. This song may be playing on a dancefloor.,10.0
je1amtXOKF4.wav,"The low quality recording features a sustained strings melody over which there is a mellow arpeggiated harp melody being played. It sounds spooky, haunting and emotional - like something you would hear in thriller mystery movies.",10.0
r5xTmK2Fq1w.wav,"The low quality recording features a reggae song that consists of flat male vocals, alongside filtered, echoing male vocal and doubling background vocals, singing over punchy kick and snare hits, energetic crash cymbals, tinny wooden percussions, groovy bass and synth keys chords. It sounds energetic, as it is upbeat and addictive, thanks to the cadence.",10.0
6oqbYipROOs.wav,"The low quality recording features a traditional song that consists of a breathy flute melody in the right channel and acoustic guitar chords in the right channel of the stereo image, followed by wooden percussion, simple bass and arpeggiated string melody. It sounds soulful and the recording is noisy.",10.0
mu0dlj8ibA4.wav,"The low quality recording features an organ keys melody played over playback instrumental that consists of groovy bass, plucked melody and some wooden percussion. It sounds weird, bouncy, happy and the recording is very noisy.",10.0
_HXMIdSiOMA.wav,The music excerpt features a kind of vinyl scratch solo. At one point a male voice intervention can be heard that's similar to the sound one makes when he's being punched in the stomach. In the background a drum beat runs in loop.,10.0
sUh43prJYMM.wav,"This music is an animated instrumental. The tempo is fast with a lively cello bass line , viola and violin harmony with a  lead strung instrument which is either an Auto Harp or electric guitar. There is a child’s voice superimposed on the music with incoherent words and a lot of static. The music is lively, intense,playful, fun, cheerful, animated and breezy. This music is an animated Pop.",10.0
jPOWgfA0zAo.wav,"The low quality recording features a passionate male vocal, alongside passionate female vocal in the left channel of the stereo image, singing over shimmering hi hats, which are also in the left channel, widely spread funky electric guitar chords, synth keys melody in the right channel, groovy bass, wooden percussions and mellow rimshots. It sounds happy, joyful, easygoing and chill.",10.0
Ts3ZcUaELzA.wav,Someone is playing a distorted e-guitar melody in the lower mid-range. This song may be playing at home practicing guitar.,10.0
D0L-M4trkpw.wav,"The drums and the upright bass are playing in a bluesy, country vibe with a half open hi hat. An acoustic guitar is strumming chords that are almost not noticeable. The e-guitar is playing a loud lead melody in the foreground while a violin is playing short bowed notes along. This is an amateur recording. This song may be playing in a bar.",10.0
DMwvY--3XD0.wav,This children's song features the voices of children singing the  main melody. This is accompanied by percussion playing a simple beat. A keyboard plays the sounds of a marimba to give this song a reggae feel. The bass plays the root notes followed by a run at every chord change. This song has a happy mood. This song can be played in a children's animation movie.,10.0
_qf0UiKtB3k.wav,This is a classical music piece. The piece is being performed on a harpsichord. There is a sophisticated aura to it. The piece has a medieval sound. It would fit perfectly in the soundtrack of a historical drama movie that takes place in the medieval era. It could also work well as the opening theme for a literature YouTube channel.,10.0
LK6zk03lPlM.wav,This is a jingle piece in the background of a tech comparison video. There are various sound effects such as clock ticking and a camera shutter. The electric guitar is playing the same chord repeatedly with electronic drum hits to create an aura of tension. This piece can be used in advertisement jingles. It could also be used in the soundtrack of reality competition programs.,10.0
-kpR93atgd8.wav,An acoustic drum is playing along with a bassline giving the song a ska/reggae feeling. The e-guitar strumming on the offbeat supports that feeling while a keyboard is playing a bell-sounding chord. Bongos are setting little accents at the end. A saxophone is playing a melody along. This song may be playing at a festival outside while the sun is shining.,10.0
OO1Q-3kXCtM.wav,The low quality recording features a widely spread harmonizing french horn melody. It sounds emotional and passionate.,10.0
6cQbxwbBqqI.wav,This audio contains someone playing a chord on a ukulele. A male voice is talking in the midrange. This is an amateur recording. This may be playing live while taking a ukulele workshop.,10.0
L5CgdTtGv8o.wav,The instrumental music features three instruments and no voice. The bass guitar and electric guitar play the same melody in unison. The drums play a repeating but not simple rhythm. I can hear influences ranging from funk to rock so I would say that the music comes closest to the fusion genre.,10.0
X96v9LlsjJM.wav,"The low quality recording features a wide crowd sound effects that include loud clapping, whistling and cheering, while the orchestra is playing in the background. It sounds reverberant and like it was recorded with a better quality phone.",10.0
woyCm7d2UIM.wav,This is the recording of a latin dance music piece. It has a male vocalist singing the same word repeatedly at a medium-to-high pitch. There is an accordion playing the melody and a bass guitar in the background. The electronic drums play a latin beat for the rhythm. There is a constant rising and accelerating pattern in the piece. The sound of people shouting can be heard in the recording. The atmosphere is very loud and vibrant.,10.0
aeDZVfGk7bk.wav,This audio contains someone playing a mouthwarp. Then another recording starts where someone is strumming chords on an e-guitar fingerpicking a melody. This song may be playing for a photo slide show made for the family.,10.0
mFcHGbnNtSQ.wav,"The low quality recording features a live performance of a jazz song and it consists of a passionate female vocalist singing over groovy piano melody, saxophone melody, groovy bass, shimmering hi hats, punchy snare and soft kick hits. It sounds passionate, soulful and the recording is noisy and in mono.",10.0
WoXgPQQjcJU.wav,The low quality recording features a loud didgeridoo modulating low tone. It is in mono and it sounds buzzy and kind of weird.,10.0
Gde1fn1Y1uM.wav,"This hard rock song features a male voice singing the main melody. The song starts with a distortion guitar playing a riff. The percussion plays a simple beat in common time. Once the voice starts singing, the guitars play power chords using down strokes. The bass follows the root notes of the chords. The mood of this song is happy. This song can be played in a car chase sequence in a movie.",10.0
LR3U4b_fVBc.wav,"The song is an instrumental. The song is medium tempo and tempo changes occur later, with piano accompaniment, guitar solo, chord changes, steady drumming rhythm, rhythm  guitar, and strong bass line . The song is an iconic rock hit and has a bad audio quality.",10.0
ATDi-irUEWc.wav,"The low quality recording features a muffled male vocal speaking, right after the didgeridoo tone. The recording is noisy and in mono.",10.0
GWcMqKYOJR4.wav,"This clip features a drum solo being played. The first beat in the clip is played by striking the hi-hat and kick twice and then the snare once. This pattern is repeated three times followed by a roll. The snare is played four times followed by the toms. This pattern is played twice. This is followed by a pattern where the snare and toms are struck in a sequence of four strokes, five strokes and six strokes all fitting within the counts of the bar. This song is a demo of the percussion instrument being used.",10.0
THfTLXBLpJE.wav,This is a low quality audio featuring a male voice singing the main melody. Another voice sings in harmony with the main voice. /the melody is simple and repetitive. This is accompanied by percussion playing a simple beat. The bass plays the root notes of the chords. Trumpet play fills in between lines. This is a happy song. This song has a ska feel. This song can be played at a retro style dance party.,10.0
3B-YYTbpFZE.wav,"The low quality recording features a flat male vocal narrating over flame sounds and wooden surface scratching sounds, after which there is a cut to a shimmering shaker and wooden percussion playing. The recording is noisy and in mono.",10.0
-m9pH0WXQto.wav,"The Electro Pop song features a flat female vocal, occasionally supported by wide background female doubling vocals, singing over quiet drums, groovy and boomy bass, arpeggiated synth melody and some sound effects of the airplane and the explosion. In the second part, the drums cut through the mix more, therefore they are more audible, while the new elements appear, including shimmering bells and simple hi hats. Sounds like a low quality recording, especially because of that first part of the loop.",10.0
dqJSTTS7HTY.wav,Someone is playing an acoustic guitar while a male voice in the mid range is singing accompanied by kids singing with him. This is an amateur recording. This song may be playing live in a school during music class.,10.0
OHrrS6AKW_c.wav,The tune is instrumental. The tempo is variable with a drum machine playing different styles and tempos. The song is a demonstration of a synth drum module with a guitar lead playing in the background. The audio quality is poor with hissing tones.,10.0
wwbATvWFaLY.wav,"This is a French opera music piece. It is an instrumental piece. There are two harpsichords performing the piece. There is a medieval sound to the piece. It has a dramatic and grandiose feel. This piece could be used in the soundtrack of a movie or a TV series that takes place in the medieval era, especially during scenes of intrigue.",10.0
rTBQmP6Vt0g.wav,"This song is an instrumental. The tempo is medium fast with enthusiastic drumming, congas and canon rhythm,electronic guitar harmony, keyboard accompaniment and a wind instrument playing a melodious harmony. There is the sound of chattering in the background. The audio is of inferior quality and muddled. The song is energetic, spirited and melodic with a catchy dance groove.",10.0
eAFKjP7o1as.wav,This is the live performance of a Baroque music performance. There is a male vocalist singing at a very high pitch. The melody is being played by a harpsichord. There is a medieval sound to this piece. It could be used in the soundtrack of historical dramas that take place in Medieval Europe.,10.0
HXG8DnTpyPc.wav,"This instrumental song features a violin playing the main melody. This is accompanied by a guitar playing chords. The piano plays backing chords. At the end of the song, the piano plays a fill. The bass is played on a double bass. There is no percussion in this song. The mood of this song is romantic. This song can be played in a romantic movie.",10.0
0AhX-ReXovI.wav,"Someone is playing a simple groove on tablas. In the background you can hear a backing track playing a flute melody along with synth pads, shaker/chime sounds and a tambourine. This song may be playing practicing tablas at home.",10.0
KfLxBjl-aBU.wav,"The low quality recording features a didgeridoo melody and some water flowing sounds in the background, as it was recorded outdoors. The recording is mono and noisy.",10.0
HEhogaw0vUg.wav,"The low quality recording features a live performance of a pop song and it consists of flat female and male vocal rapping over ""4 on the floor"" kick pattern and electric guitar melody. There are some crowd clapping and cheering noises in the background. It sounds exciting and energetic.",10.0
HLsRePLObfI.wav,The song is instrumental. The tempo is fast with a beautifully played hand pan arrangement by a soloist. The song is ethereal and innocent in its beauty. The audio quality is average.,10.0
n1PTn_NH_K0.wav,This is a gear showcase video demonstrating the sound difference when an electric guitar is connected to an amp. The electric guitar is playing simple tunes. A male voice is describing the applied effect. Sounds from this piece can be sampled for use in beat-making.,10.0
dbenNuhAW_I.wav,This is a Vedic music piece. There are female vocals singing in a devotional manner. There is a veena playing a repeated theme for the melody. The rhythmic background is being provided by the tabla. The atmosphere is religious. This piece could be playing in the background at Hindu religious events.,10.0
669Fk7afszw.wav,An acoustic guitar is strumming chords while a banjo is playing a fast melody over it. In the background you can hear an upright bass playing a fast walking bassline. Also in the background noises of people speaking can be heard. This song may be playing live on the streets performed by buskers.,10.0
2kORDnISun4.wav,A choral harmony consisting of four parts sings this ethereal harmony. The song is medium tempo with a church organ and orchestra accompaniment. The song is heavenly and innocent. The audio quality is poor.,10.0
ivymRS3iEZk.wav,"The low quality recording features a sustained didgeridoo melody being played. It sounds low, suspenseful and the recording is noisy and in mono.",10.0
TIAj-fi_R7c.wav,"The low quality recording features a jazz song that consists of a passionate trumpet melody in the left channel of the stereo image and mellow piano chords in the right channel, followed by smooth double bass and shimmering hi hats. It sounds soft, mellow, passionate and relaxing. The recording is a bit noisy.",10.0
GXLeUXSVFYU.wav,someone is strumming a melody on a banjo along with some chords. In the background you can hear people talking. This is an amateur recording. This song may be playing outside at a bonfire surrounded by friends and family.,10.0
Cwbtn_h6TP8.wav,"A female singer sings this screaming metal melody. The song is medium tempo with a steady metal drumming rhythm, steady bass line and a distorted guitar playing rhythm. The song is rebellious and passionate. The audio quality is very poor.",10.0
aGMdcxeF6Ak.wav,"A girl band sings this lively song. The tempo is medium with vibrant music. The audio quality is inferior so the music and vocals are incoherent. This is a live performance with ambient sounds of fans cheering, clapping and singing along. This song is a hit Country Rock.",10.0
w41gqTFYh08.wav,This song contains a minor chord composition on a acoustic piano. The drums is playing a slow groove with lot of pauses and a snapping snare sound. On top of that a male voice is singing in a higher pitch sounding sad. Male backing vocals are providing harmonie and support. This song may be playing with headphones during a breakup with a partner.,10.0
wRWxsKN394Q.wav,This audio contains a musical composition played by a big horn section and a lot of flutes. Someone is playing a simple and loud groove on the drums. In the background you can hear someone playing a marimba. This song may be playing live at a big sports event.,10.0
CrbZHPkHeV4.wav,"A male vocalist sings this passionate Rap. The tempo is medium with steady drumming, keyboard harmony, amplified piano accompaniment, and  groovy bass lines . The song is emotional, intense, persuasive, intense and has a catchy groove. This song is contemporary Rap/Hip-Hop.",10.0
TnJE6W6Z6mM.wav,A female singer sings this operatic melody. The song is medium tempo with a string section playing harmony and a piano accompaniment. The song is emotional and passionate. The song is a classic western music hit and a movie soundtrack.,10.0
_vwBe9ZXWXE.wav,This clip is a live recording of a complex and rapid piece being played on the trumpet. The trumpet is very high pitched and the piece ascends and descends rapidly in succession.,10.0
We9P_UcHNk8.wav,The low quality recording features a cover of an alternative/indie song that consists of acoustic guitar melody. It sounds groovy and the recording is in mono and noisy.,10.0
rFwJ2L-geWw.wav,The music excerpt features a piano playing a repeating melody in the background. Finger snaps can be heard playing the same rhythm that the piano does. In the background a noise similar to a vacuum cleaner can be heard. It sounds as if this whole thing was recorded with a phone or by an amateur.,10.0
32C6w8V7TX8.wav,The pop music features a female voice singing and being accompanied by other female voices. The drums and bass guitar play a simple and repetitive groove and drive the pulsation of the music. An electric guitar is playing a funky accompaniment. A group of strings play a repetitive melody that ascends in pitch with each repetition.,10.0
AVsNJgR_K6w.wav,This is a congregational singing performance performed at a Christian church. Male and female voices from all age groups are singing together in this piece. The atmosphere is religious. This piece could be used in the soundtrack of a gospel movie.,10.0
ALU-1AILj1c.wav,"This music is a mellifluous Indian classical instrumental. The tempo is fast with a harmonic sarod and rhythmic Oud accompaniment. The music is mesmerising, spirited, engaging, captivating and skilfully rendered Ragas. This instrumental is an Indian/Pakistani classical music.",10.0
PSYURntIjuc.wav,"Animated vocalists singing a choral harmony. The song is medium tempo with no instrumentation, but just voices singing in various harmonic ranges. The song is cheerful and cartoonish. The song is a parody of a modern pop song with western classical music influences.",10.0
KoAGZ_dB8MM.wav,"A female singer sings this eerie melody. The song is medium tempo with a rolling bells keyboard harmony, and other ambient echo tones and harp tones. The song is haunting and unsettling. The audio quality is very poor and not enjoyable.",10.0
dsibOgkezN8.wav,"An acoustic guitar and a piano are playing the same chords as single notes with strings underlining the composition. A female voice is singing, sounding fragile and sad. This song may be playing during a sad movie scene.",10.0
vtVfl5Ff5lw.wav,The track is an upbeat blues song that features falsetto and raspy male vocals. A drum kit plays an energetic and happy beat. A bass guitar follows the rhythm and adds a bouncy vibe to the song. The overall sound of the instruments is bright and happy. A guitar follows the bass and the drum kit.,10.0
vmBkZflwViA.wav,This is a classical music piece performance. It is meant to be played at a wedding. There is an organ playing a simple and festive tune. There is an atmosphere of celebration in this piece. This music would fit perfectly with weddings. Organ samples could also be lifted from this recording to be used in beat-making.,10.0
KSFND-AdqZs.wav,This audio contains a e-guitar running through a tremolo effect that gets into faster modulation speed. This is an amateur recording and may be used for educational purposes.,10.0
dwSj0Rr3vFc.wav,A string section is playing a melody in the mid to high register. A bansuri flute is playing the same melody along. Digital and acoustic drum/percussion elements are playing a beat that does not occupy a lot of space. A male voice is singing at a higher pitch. This song may be playing in a hindi-movie.,10.0
rh2D2OSxyw0.wav,"The low quality recording features an uptempo song, that consists of groovy bass and punchy kick and snare hits, being aggressively scratched by a DJ. It is very reverberant, as the sound diffuses and reflects in the space that the DJ is playing.",10.0
XfLIbeSJSHE.wav,"This is the sound of a wooden drawer being opened and a bunch of nails dropped on a surface. A very faint pop music can be heard with a melodically singing female vocal, strings and a simple electronic drum beat.",10.0
q7s7C4oNlFo.wav,"This is an intuitive folk/neo-folk music piece. There is a female vocalist singing over multiple tracks, one being the minor harmonies of the other. There is an acoustic guitar playing a gentle, simple tune. The atmosphere of this piece is heart-touching. The music could fit very well in the soundtrack of a drama movie or a TV show.",10.0
WcC9sKxJ1gI.wav,This is a clip featuring a motif from an instrument that sounds a little like a theremin whistle. There is a fuzzy quality to the instrument as well. This song feels like an eighties pop style song.,10.0
Cchf2QH63bI.wav,The track features a scary and confused atmosphere. A female singer with a grating voice screams incomprehensive vocals. A piano accompanies the vocals. The track is simple but has a strong presence.,10.0
AAWe4zRLVVU.wav,This is the opening theme of a program that was meant for kids. It is in an instrumental piece. There is a keyboard playing the main melody in the lead. There is a bass guitar playing in the background. The rhythm is provided by a fast-tempo acoustic drum beat. There are various sound effects that add a lively texture to this piece. The atmosphere is playful. This piece could be used in kids shows or cartoons. It could also be played during kindergarten activities or child birthday parties.,10.0
sYIymaJi6tc.wav,This is the acoustic version of a hard rock piece performed by an orchestra of ukulele players. There are two male vocalists and one female vocalist singing melodically. The different sections of the tune are all being played by a separate ukulele. The atmosphere is easygoing. This piece could fit well in the soundtrack of an animation movie or a comedy movie.,10.0
Sr2Grfi3lFg.wav,"This song would be classified as bubblegum pop. The  music is more suitable for children, as it has a young and light-hearted style of production. There's a bright and tinny synth which is used to play a repeated motif, and at one point we hear a pair of birds mimicking the melody in their squeaky bird-like tones.",10.0
DgqPgNqW2hE.wav,"A female singer sings this beautiful vintage French melody. The song is medium tempo with a steady drum rhythm, steady bass line, piano accompaniment , string section harmony and some lush snare play. The song is romantic and cheerful with an avant-garde nature.",10.0
KpwdlYIdtfs.wav,The song is an instrumental. The song is medium tempo with a loud crash tone which undulates percussively and fades. The song is of poor audio quality and probably faded with a lot of humming noise.,10.0
